action,keywords,parent,description,title,application_type
main_view_transform_none,,,Use the left mouse button for picking.,,
main_view_transform_rotation,,,Use the left mouse button for rotation.,,
main_view_transform_translation,,,Use the left mouse button for translation.,,
main_view_transform_zoom,,,Use the left mouse button for zooming.,,
main_view_translate_mX,,,Translate the Workspace in the &minus;<i>x</i> direction by the keyboard translation increment.,,
main_view_translate_mY,,,Translate the Workspace in the &minus;<i>y</i> direction by the keyboard translation increment.,,
main_view_translate_mZ,,,Translate the Workspace in the &minus;<i>z</i> direction by the keyboard translation increment.,,
main_view_translate_pX,,,Translate the Workspace in the &plus;<i>x</i> direction by the keyboard translation increment.,,
main_view_translate_pY,,,Translate the Workspace in the &plus;<i>y</i> direction by the keyboard translation increment.,,
main_view_translate_pZ,,,Translate the Workspace in the &plus;<i>z</i> direction by the keyboard translation increment.,,
main_view_zoomin,,,Zoom in by a small increment ,,
main_view_zoomout,,,Zoom out by a small increment.,,
main_workspace_animation_settings,,,"Animate the Workspace by spinning it or rocking it from side to side, and save a movie of the animation.<br/>Opens the Animation Settings dialog box.",Animate Workspace...,Workspace Operations
main_workspace_clear,,,"Remove everything from the Workspace. If there are scratch entries in the Workspace, you may need to confirm their removal.",,
main_workspace_fullscreen,,,Expand the size of the Workspace so that it occupies the entire screen of your monitor (or laptop).,,
make_helices.panel,,,Create helical structures from sequences in a .seq file and add them as project entries. Opens a file selector to select the sequence file.,,
manage_reagent_library_gui.panel,,,"Select, create, import, export, and delete reactant libraries, used in enumeration tools.<br/>Opens the Manage Reactant Libraries panel.",Manage Reactant Libraries...,Enumeration and Ideation
managecharts,,,Manage charts of property data generated from project entries<br/>Opens the Manage Charts Panel.,,
managesurfaces,,,"Manage the surfaces associated with project entries. This includes selecting surfaces to display, setting parameters for the appearance and display of surfaces, importing and exporting surfaces, and deleting surfaces.<br/>Opens the Manage Surfaces panel.",,
manipulate_cell_gui.panel,,,"Modify a simulation cell by swapping or flipping axes, aligning the origin or an interface, or straining the cell.<br/>Opens the Manipulate Cell Panel.",,
mark_monomer_head_tail_gui.panel,,,"Mark the head and tail atoms of a monomer so that they can be identified in subsequent applications, such as for use in Canvas QSAR modeling.<br/>Opens the Mark Monomer Head and Tail panel.",,
mark_target_entry,,,"Mark or clear the mark for the current entry, creating the Mark property as necessary.",,
materials_conformational_search_gui.panel,,,"Perform a conformational search on an organometallic complex with the coordination around the metal held fixed, with optional QM refinement.<br/>Opens the Organometallic Conformational Search Panel.",,
materials_explorer,cheminformatics,,,Materials Explorer...,Discovery Informatics and QSAR
matsci_event_analysis.panel,,,"Analyze a trajectory from a Desmond MD simulation and present information on bulk properties derived from the trajectory, such as plots of the density and the cohesive energy.<br/>Opens the MS MD Trajectory Analysis panel.",,
matsci_meta_workflow_gui.panel,,,Set up workflows to combine multiple simulation tasks from a simulation protocol into one job.<br/>Opens the Meta Workflow Builder Panel.,,
matsci_ml_prediction_gui.panel,,,"<!-- ML -->
Use pre-built machine learning models to make predictions on various properties.<br/>Opens the Machine Learning Property Prediction Panel.",,
matsci_panel_explorer_gui.panel,,,Learn which Schrdinger tools are the best fit for your research.<br/>Opens the Materials Science Panel Explorer Panel.,Find panels related to your interests...,Materials
matsci_restart_gui.panel,,,"Restart one of the restartable Materials Science workflows, chosen by job type. Restarting can be done on jobs that fail due to problems such as resource, hardware, or network issues.<br/>Opens the Restart Workflow panel</a>.",,
matsci_run_meta_workflow_gui.panel,,,Apply built-in and previously saved meta workflows to systems of interest.<br/>Opens the Run Meta Workflow Panel.,,
mc_sa_gui.panel,,,"Locate sites of adsorption of an adsorbate on a surface using Monte Carlo - Simulated Annealing simulation, and analyze the energetics of adsorption.<br/>Opens the Adsorption Site Finder panel</a>.",,
mcs_docking_gui.panel,,,Align a set of congeneric ligands to a dynamically adjustable set of reference ligands using Glide docking with MCS core constraints.<br/>Opens the MCS Docking Ligand Alignment panel,,
mcsd,,,"<!-- MacroModel, MMOD, MC, MD, SD, conformational search -->
Run a Monte Carlo/Stochastic Dynamics calculation at constant temperature on a structure. The MMFF and the OPLS series of force fields with various electrostatic treatments, including GB/SA, can be used.<br/>Opens the MC/SD panel.",,
mcsligalign,"alignment, mcsdocking, superimpose, superpose, superimposition, mcs",,,MCS Docking Ligand Alignment...,Structure Alignment
md_descriptors_gui.panel,,,"<!-- MD descriptors, ML, descriptors, MD, molecular dynamics -->
Calculate descriptors for molecular structures using molecular dynamics simulations, which can then be used in machine learning.<br/>Opens the MD Descriptors Panel.",,
measurement_delete,,,Delete all measurement labels from the Workspace.,,
measurement_panel_1h_nmr_coupling,,,Predict NMR spin-spin coupling constants for pairs of vicinial hydrogens.<br/>Opens the Measurements panel at the 1H NMR Coupling tab.,,
measurement_panel_angle,,,Measure angles between sets of three atoms.<br/>Opens the Measurements panel at the Angles tab.,,
measurement_panel_dihedral,,,Measure dihedral angles between sets of four atoms.<br/>Opens the Measurements panel at the Dihedrals tab.,,
measurement_panel_distance,,,Measure distances between pairs of atoms.<br/>Opens the Measurements panel at the Distances tab.,,
measurement_panel_picked_reposition,,,Reposition measurement labels in the Workspace by dragging.,,
measurement_pick,,,Pick atoms in the Workspace to make a measurement of the currently selected type.,,
measurementx,,,"Make measurements of distances, angles, and dihedrals in the Workspace.<br/>Opens the Measure banner.",,
medchem_confsearch_gui.panel,,,"Run a conformational search on the Workspace structure and plot the resulting conformer energies. A rapid or a thorough search can be performed, with a choice of solvent. <br/>Opens the Conformational Search panel.",,
medchem_flexalign_gui.panel,,,Align the selected entries in the Project Table to the entry in the Workspace. Torsional adjustment is performed to obtain the best alignment. <br/>Opens the Flexible Ligand Alignment panel.,,
medchem_minimization_gui.panel,,,"Minimize the Workspace structure using MacroModel, with a choice of solvents.<br/>Opens the Minimization panel.",,
medchem_molprop_gui.panel,,,"Display properties of a structure: molecular weight, AlogP, polar surface area, rotatable bonds, H-bond donors and acceptors, and SMILES string. The properties are updated when you modify the structure. <br/>Opens the Interactive Properties panel.",,
membrane_analysis_gui.panel,,,...<br/>Opens the Membrane Analysis Panel.,,
membrane_analysis_viewer_gui.panel,,,...<br/>Opens the Membrane Analysis Viewer Panel.,,
membrane_permeability_gui.panel,,,"Calcuate the passive membrane permeability of a congeneric set of ligands, based on calculations using continuum solvation models of both membrane and water.<br/>Opens the Membrane Permeability panel.",,
membrane_permeability_gui.show_panel,,,"Calculate the passive membrane permeability of a congeneric set of ligands, based on calculations using continuum solvation models of both membrane and water.<br/>Opens the Membrane Permeability panel.",,
menu_contacts_panel,,,"Display contacts in the Workspace, choose the types of contacts and the atoms they are displayed for, and set the color of the markers.<br/>Opens the Non-Bonded Interactions panel.",,
menu_hbonds_panel,,,"Display hydrogen and halogen bonds in the Workspace, choose the types of bonds and the atoms they are displayed for, and set the color of the markers.<br/>Opens the Non-Bonded Interactions panel.",,
menu_piinteractions_panel,,,"Display pi interactions in the Workspace, choose the types of interactions and the atoms they are displayed for, and set the color of the markers.<br/>Opens the Non-Bonded Interactions panel.",,
merge_duplicates,,,,Merge Duplicate Ligands...,Project Table and Project Operations
merge_duplicates_gui.panel,,,"Combine a set of structures into a single file with elimination of duplicates. The elimination is done by comparing SMILES strings, and the output is either a SMILES file or a 2D SD file; in either case the output contains no 3D information other than chirality properties.<br/>Opens the Merge Duplicates panel.",,
microkinetics_deposition_analysis_viewer_gui.panel,,,Analyze microkinetic modeling calculation results for deposition processes.<br/>Opens the Microkinetics Deposition Analysis Panel.,,
microkinetics_gui.panel,,,Predict and understand rates of catalytic reactions of interest.<br/>Opens the Microkinetic Modeling Panel.,,
microkinetics_viewer_gui.panel,,,Plot the results of a microkinetic modeling calculation.<br/>Opens the Microkinetic Modeling Viewer Panel.,,
mini,,,"Minimize the energy of one or more structures with respect to their geometries, using a force field and optional constraints. If the structures are conformers, redundancies can be removed and an energy filter applied. Structures can also be minimized in two solvents, to obtain partition coefficients. The MMFF and the OPLS series of force fields with various electrostatic treatments, including GB/SA, can be used.<br/>Opens the Minimization panel.",,
minimization_ab_initio_qm,"minimization, Ab",,,Ab Initio QM...,General Modeling
minimization_complex,minimization,,,Ligand-Receptor Complex...,General Modeling
minimization_force_field,minimization,,,Force-Field...,General Modeling
minimization_qm_mm,minimization,,,QM-MM...,General Modeling
minimize,,,"<!-- minimization -->
Minimize the energy of a protein structure or substructure with respect to its geometric coordinates, optionally including periodic boundary conditions, an implicit solvent, and an implicit membrane.<br/>Opens the Minimize panel.",,
minimize_tm_complexes.panel,,,Clean up the structure of one or more complexes by performing a force-field minimization.<br/>Opens the Complex Cleanup panel,,
minimizerigid,,,"<!-- protein, rigid-body, rigid body -->
Minimize portions of the structure as rigid bodies with respect to position and orientation. The minimization can also include freely moving atoms, and can optionally include periodic boundary conditions, an implicit solvent, and an implicit membrane.<br/>Opens the Minimize as Rigid Body panel.",,
mixed_solvent_md,"MD, mxmd, mixed solvent, sitemap",,,Mixed Solvent MD...,Desmond
ml_formulations_gui.panel,,,<!-- ML -->Build and apply machine learning models for predicting formulations properties.<br/>Opens the Formulation Machine Learning Panel.,,
ml_formulations_optimization_gui.panel,,,Apply machine learning models for optimizing the formulation of a mixture.<br/>Opens the Formulation Machine Learning Optimization Panel.,,
ml_model_manager_gui.panel,,,<!-- Machine Learning Model Manager -->Re-train machine learning models with the software release version in use.<br/>Opens the ML Model Manager Panel.,,
ml_qsar_gui.panel,"ML, QSPR",,"<!-- QSPR, ML -->Build and apply individual QSAR models from a selection of regression and classification methods.<br/>Opens the Build and Apply QSAR Model Panel.",Build and Apply QSAR Model...,Discovery Informatics and QSAR
mlff_gui.panel,,,Use pre-built machine learning force field models to make predictions on energy and geometry.<br/>Opens the MLFF Calculations (Beta) Panel.,,
mmod_to_kcal,,,,Convert MacroModel Energies to kcal/mol,Project Table and Project Operations
mmod_to_kcal.mmod_to_kcal,,,"Convert all MacroModel energies from kJ/mol to kcal/mol, creating new project properties.",,
mof_enumeration_gui.panel,,,Enumerate metal-organic frameworks from a chosen metal system and a library of organic linkers.<br/>Opens the Enumerate Metal-Organic Frameworks panel,,
mogul_analysis,mogul,,,CSD Analysis...,Structure Analysis
mogul_query,mogul,,,CSD Search...,Structure Analysis
moldyn,,,"Run a molecular dynamics or stochastic dynamics calculation on a non-periodic structure. The MMFF and the OPLS series of force fields with various electrostatic treatments, including GB/SA, can be used.<br/>Opens the Dynamics panel.",,
molecular_descriptors,"cheminformatics, properties",,,Molecular Descriptors...,Discovery Informatics and QSAR
molecular_descriptors.panel,,,"Compute topological descriptors, QikProp properties and semiempirical electronic (MOPAC) properties for a set of structures.<br/>Opens the Molecular Descriptors panel.",,
molecular_materials_descriptors_gui.panel,,,"<!-- ML -->
Generate molecular descriptors suitable for materials applications, to use in machine learning.<br/>Opens the Generate Molecular Materials Descriptors panel.",,
mopac_main,minimization,,,Semiempirical,General Modeling
mopac_main_gui.panel,,,Set up and run a semiempirical NDDO quantum chemical calculation with the MOPAC package.<br/>Opens the MOPAC Panel.,,
morphology_gui.panel,,,Calculate surface energies of crystal surfaces for estimating relative growth rates and particle shapes.<br/>Opens the Crystal Morphology Calculations Panel.,,
move_atoms,,,"Move a selected set of atoms by translation or by rotation about their centroid, and other similar actions.<br/>Opens the Move Atoms banner.",,
move_selected_atoms_gui.panel,,,"<!-- move atoms -->
Move the atoms selected in the Maestro workspace through translation or rotation.<br/>Opens the Move Selected Atoms Panel.",,
movie.movie_entries movie_entries.gif,,,Create a movie from the entries that are selected in the Project Table.,,
movie_entries,,,,Movie from Selected Entries...,Project Table and Project Operations
msv.panel,,,"Perform modeling tasks with sequences, including visualization, alignment, structure and property predictions, analysis, and homology modeling.<br/>Opens the Multiple Sequence Viewer/Editor panel.",,
multicomplex_builder_gui.panel,,,"Build a set of organometallic complexes from a set of ligands. Each complex is composed of a metal, an optional &quot;sentinel&quot; ligand that remains the same in each complex, and enough copies of one other ligand to fill the coordination sites for the chosen complex geometry around the user defined metal center.<br/>Opens the Build Multiple Complexes panel",,
multiseqviewer,"chimeric, msv, multiple sequence alignment, multiple sequence viewer, sequence",,,Homology Modeling...,Protein Preparation and Refinement
multiseqviewer.panel,,,"Visualize, manipulate, and align multiple sequences and their properties, and perform homology modeling with the aligned sequences.<br/>Opens the Multiple Sequence Viewer panel.",,
multiseqviewer2,"homology modeling, chimeric, msv, multiple sequence alignment, multiple sequence viewer, sequence",,,Multiple Sequence Viewer/Editor...,Protein Preparation and Refinement
multispectra_analysis_gui.panel,,,Combine and adjust visible spectra to generate a spectrum and analyze its color properties.<br/>Opens the Multispectra Analysis Panel.,,
mutate.panel,,,Create mutated structures from the Workspace structure by picking a residue to mutate and choosing a set of mutations. The mutated structures are added as new project entries.<br/>Opens the Mutate panel.,,
mutation_gui.panel,,,Interactive tool to identify protein residues or loops and request mutations. Residue-based mutations include changes to other standard residues and chirality inversion. Loop-based mutations can request replacement of an existing loop with a second sequence of any length and any standard-residue composition. Loop replacement is carried out by identifying and grafting on an appropriate template in a curated PDB database.<br/>Opens the Residue and Loop Mutation panel.,,
mxmd_gui.panel,,,Perform Mixed Solvent Molecular Dynamics (MxMD) simulations and view the results.<br/>Opens the Mixed Solvent MD Panel.,,
nanoparticle_gui.panel,,,Build  a nanoparticle of a particular shape and size from the structure in the Workspace.<br/>Opens the Nanoparticle Builder panel.,,
nanoreactor_gui.panel,,,Sample potential energy surfaces or determine elementary reaction networks using xTB metadynamics and optionally identify their thermodynamic sorting with free energy refinement.<br/>Opens the Nanoreactor Panel.,,
nanoreactor_viewer_gui.panel,,,Plot the results of a nanoreactor calculation.<br/>Opens the Nanoreactor Viewer Panel.,,
nanostructure_gui.nanosheet_panel,,,"Build nanosheets from a specified asymmetric unit, composition, and geometry to a given size. Multi-layer nanosheets can be constructed as well as single nanosheets. <br/>Opens the Nanostructure Builder panel.",,
nanostructure_gui.nanotube_panel,,,"Build nanotubes from a specified asymmetric unit, composition, and geometry to a given size. Multi-walled nanotubes can be constructed as well as single-walled nanotubes, and nanotubes with a range of chiral indices can be generated. <br/>Opens the Nanostructure Builder panel.",,
nanostructure_gui.panel,,,"Build nanotubes or nanosheets from a specified asymmetric unit, composition, and geometry to a given size. Multi-walled nanotubes and multi-layer nanosheets can be constructed as well as single-walled nanotubes and single nanosheets, and nanotubes with a range of chiral indices can be generated. <br/>Opens the Nanostructure Builder panel.",,
neb_gui.panel,,,"<!-- qe, neb -->
Generate a minimum energy path (MEP) between two minimized structures by the nudged elastic band method.<br/>Opens the Nudged Elastic Band Calculation panel.",,
neb_monitor_gui.panel,,,"<!-- qe, neb -->
Monitor the convergence of a nudged elastic band calculation.<br/>Opens the Nudged Elastic Band Monitor Panel.",,
neb_restart_gui.panel,,,"<!-- qe, neb -->
Restart a failed or unconverged nudged elastic band job.<br/>Opens the Nudged Elastic Band Restart panel",,
new_kmc_compute_charge_mobility_gui.panel,,,"Compute charge mobility in an amorphous solid using kinetic Monte Carlo methods for carrier hopping, based on hopping data from Jaguar and QSite calculations.<br/>Opens the Compute KMC Charge Mobility panel.",,
new_kmc_hopping_params_gui.panel,,,Compute hopping parameters in an amorphous solid using Jaguar and QSite calculations.<br/>Opens the Compute KMC Hopping Parameters Panel.,,
nmr_viewer_gui.panel,,,Plot NMR spectra from a Quantum ESPRESSO calculation.<br/>Opens the NMR Viewer Panel.,,
non_standard_residues_gui.panel,,,"Set up a database of nonstandard residues, by building new residues or importing existing residues, and choose the nonstandard residues that are shown in the residue selection tools for residue scanning.<br/>Opens the Nonstandard Residues panel.",,
oled_ml_formulations_gui.panel,,,Build and apply machine learning models for predicting OLED device properties.<br/>Opens the OLED Device Machine Learning Panel.,,
one_step_glide_docking,"dock, docking, XP, SP, Glide, GOLD, one step",,,One-Step Ligand Docking...,Receptor-Based Virtual Screening
one_step_glide_gui.panel,,,Perform Glide grid generation and docking in a single step with a limited range of options.<br/>Opens the One-Step Glide Docking panel.,,
one_step_prepwizard_gui.panel,,,"Run protein preparation in a single step with a limited range of options, for multiple proteins.<br/>Opens the One-Step Protein Preparation panel.",,
opto_device_designer_gui.panel,,,Design optoelectronic devices and plot the device energy level diagram.<br/>Opens the Optoelectronic Device Designer Panel.,,
opto_film_props_gui.panel,,,"<!-- transition dipole moment, order parameter, seet, singlet excition energy transfer, isc, intersystem crossing, refractive index, extinction coefficient, ellipsometry -->
Calculate various optoelectronic film properties, such as transition dipole moment order parameter, singlet exciton energy transfer rate, intersystem crossing rate, refractive index, and extinction coefficient from molecular excited state properties.<br/>Opens the Optoelectronic Film Properties Panel.",,
opto_film_props_viewer_gui.panel,,,"<!-- transition dipole moment, order parameter, seet, singlet excition energy transfer, isc, intersystem crossing, refractive index, extinction coefficient, ellipsometry -->
Plot the results from an optoelectronic film properties calculation including transition dipole moment order parameter, singlet exciton energy transfer, intersystem crossing, refractive index, and extinction coefficient.<br/>Opens the Optoelectronic Film Properties Viewer Panel.",,
optoelectronics_al_gui.panel,,,"<!-- ML -->
Use an active learning workflow to arrive at a machine learning model for predicting electronic properties of molecules relevant to optoelectronics.<br/>Opens the Optoelectronics Active Learning Training Panel.",,
optoelectronics_al_predict_gui.panel,,,"<!-- ML -->
Review machine learning models generated from the optoelectronics active learning workflow and use them to make predictions on optoelectronics properties.<br/>Opens the Review and Apply Optoelectronics Active Learning Model Panel.",,
optoelectronics_electron_coupling,"fluorescence, optoelectronics",,,Electron Coupling...,Quantum Mechanics
optoelectronics_genopt,"fluorescence, optoelectronics",,,Genetic Optimization...,Quantum Mechanics
optoelectronics_genopt_gui.panel,,,Optimize one or more optoelectronic properties using a genetic algorithm for modifying the structure.<br/>Opens the Optoelectronics Genetic Optimization panel.,,
optoelectronics_genopt_viewer,"fluorescence, optoelectronics",,,Genetic Optimization Monitoring...,Quantum Mechanics
optoelectronics_genopt_viewer_gui.panel,,,"Monitor the progress of a genetic optimization of optoelectronic properties while a job is running, or examine a completed job.<br/>Opens the Optoelectronics Genetic Optimization Viewer panel.",,
optoelectronics_gui.panel,,,"Calculate electronic properties of molecules relevant to optoelectronics: oxidation and reduction potentials, hole and electron reorganization energies, singlet-triplet excitation energies, and electronic absorption spectra.<br/>Opens the Optoelectronics Calculations panel.",,
optoelectronics_perform_calculations,"fluorescence, optoelectronics",,,Perform Calculations...,Quantum Mechanics
optoelectronics_view_results,"fluorescence, optoelectronics",,,View Results...,Quantum Mechanics
optoelectronics_viewer_gui.panel,,,"View the results of optoelectronics calculations, as tabulated data and as scatter plots.<br/>Opens the Optoelectronics Results panel.",,
order_parameter_gui.panel,,,Perform an order parameter analysis on an MD simulation.<br/>Opens the Perform Order Parameter Analysis panel.,,
order_parameter_viewer_gui.panel,,,Plot the results of an order parameter analysis.<br/>Opens the Order Parameter Analysis Results Viewer panel.,,
organometallic_complex_build_multiple,organometallic complexes,,,,
organometallic_complex_build_single,organometallic complexes,,,,
organometallic_complex_cleanup,organometallic complexes,,,,
p450_calc_gui.panel,,,"<!-- P450, metabolism, CYP -->
Predict the sites of metabolism on a set of ligands for various P450 isoforms.<br/>Opens the P450 Site of Metabolism - Perform Calculation panel.",,
p450_calculate,"p450, reactivity",,,Perform Calculation...,ADME and Molecular Properties
p450_results,"p450, reactivity",,,Examine Results...,ADME and Molecular Properties
p450_results_gui.panel,,,"<!-- P450, metabolism, CYP -->
Examine the predicted sites of metabolism for a set of ligands for various P450 isoforms, and visualize the associated predicted binding modes.<br/>Opens the P450 Site of Metabolism - Examine Results panel.",,
partial_concentration_calculation_gui.panel,,,Calculate the concentration of the various molecules in a periodic structure. The volume used is that of the periodic box.<br/>Opens the Partial Concentration Calculation Panel.,,
patch_analyzer_gui.panel,"aggregation, aggscore, reactive",,"Analyze a protein surface into patches that represent distinct types of interactions: positively charged, negatively charged, and hydrophobic. For each patch a range of properties is calculated, to characterize the interaction and its intensity. These patches can be used to identify possible interaction hotspots or propensities to interact.<br/>Opens the Protein Surface Patches panel.",Protein Surface Analyzer...,Biologics
pdbname.run,,,Assign PDB names to the atoms in the Workspace structure.,,
pdbsearch_gui.panel,,,"Search the Prime PDB header database for structures that have specified text in the ID, title, compound, source, or hetname fields, and import the matching structures into Maestro.<br/>Opens the Search PDB Header Database panel.",,
pdos_viewer_gui.panel,,,Plot the projected density of states from a periodic DFT calculation as a function of energy.<br/>Opens the Projected Density of States Viewer panel.,,
penetrant_loading_gui.panel,,,"Add a rigid penetrant, such as water or methane, to vacancies in a condensed system. This is done in cycles that involve adjusting penetrant content followed by relaxation of the system.<br/>Opens the Penetrant Loading panel.",,
