action,keywords,parent,description,title,application_type
projtable_duplicateinplace,,,Duplicate the selected entries and place each new entry immediately below its source entry.,,
projtable_duplicatenewgroup,,,"Duplicate the selected entries and place the entries into a new group. Opens the New Group dialog box, in which you can give the group a title.",,
projtable_duplicateungrouped,,,Duplicate the selected entries and place the entries at the end of the ungrouped entries.,,
projtable_eplayer_gotoend,,,Include only the last selected structure in the Workspace.,,
projtable_eplayer_gotostart,,,Include only the first selected structure in the Workspace.,,
projtable_eplayer_loop_none,,,"When playing through the selected structures, stop when the end of the set of structures is reached.",,
projtable_eplayer_loop_oscillate,,,"When playing through the selected structures, reverse the direction of play when the end of the set of structures is reached.",,
projtable_eplayer_loop_singledirection,,,"When playing through the selected structures, start again at the other end when the end of the set of structures is reached.",,
projtable_eplayer_next,,,Include only the next selected structure in the Workspace.,,
projtable_eplayer_nextgroup,,,Include only the first selected entry in the next entry group in the Workspace.,,
projtable_eplayer_options,,,"Set the speed of play and specify actions to be perfomed during play, such as saving changes, superimposing entries, and running scripts.<br/>Opens the ePlayer Options panel.",,
projtable_eplayer_playbackward,,,"Include the selected structures in turn in the Workspace, moving toward the first.",,
projtable_eplayer_playforward,,,"Include the selected structures in turn in the Workspace, moving toward the last.",,
projtable_eplayer_prev,,,Include only the previous selected structure in the Workspace.,,
projtable_eplayer_prevgroup,,,Include only the first selected entry in the previous entry group in the Workspace.,,
projtable_eplayer_stop,,,Stop playing through the structures.,,
projtable_eplayer_toolbar,,,Display the ePlayer toolbar in the Project Table panel.,,
projtable_exclude_entries,,,Exclude (remove) the selected entries from the Workspace. Fixed entries are also removed with this command.,,
projtable_expand_all,,,Expand all groups.,,
projtable_expand_only_selected,,,Expand the selected groups.,,
projtable_expand_selected,,,Expand the selected groups and collapse all other groups.,,
projtable_expand_to_selected_entries,,,Expand groups to display the selected entries.,,
projtable_expand_unselected,,,Expand all groups that do not have selected entries.,,
projtable_find_replace_toolbar,,,Show or hide the Find toolbar.,,
projtable_fix_entries,,,"Include the selected entries in the Workspace, and keep them in the Workspace until explicitly excluded or unfixed, the Workspace is cleared, or the project is closed. Actions that exclude other entries from the Workspace, such as Include Only, have no effect on the fixed entries. A padlock icon appears in the In column for these entries.",,
projtable_group_include_first_entry,,,Include the first entry in each toplevel group in the Workspace.,,
projtable_group_menu_deleteallempty,,,Delete all empty groups in the Project Table.,,
projtable_group_menu_deselectall,,,Deselect all entries that are inside groups.,,
projtable_group_menu_invertselection,,,"Invert the selection of entries inside each group that has selected entries: the selected entries in each group are deselected, and the unselected entries in each group are selected.",,
projtable_group_ungroup,,,Ungroup the selected groups.,,
projtable_groupby_entryprop,,projtable_groupby_eprop,,,
projtable_groupby_eprop,,,"Group the selected entries by the value of a property. Groups are created by property range for numerical property values, and for each unique value for string property values.<br/>Opens the Group By Entry Property panel.",,
projtable_include_entries,,,Include the selected entries in the Workspace along with the entries that are already included.,,
projtable_include_only_entries,,,"Include only the selected entries in the Workspace, and exclude all others. Does not affect fixed entries.",,
projtable_lock_entries,,,"Lock the selected entries so that they cannot be modified or deleted until they are unlocked. A padlock icon appears in the Row column for these entries. You can change locked entries in the Workspace, but the changes will not be saved to the project.",,
projtable_merge_entries,,,"Merge the selected entries into a single entry. The merged entry is placed after the last selected entry, inside the last entry's entry group if one exists.",,
projtable_move_group,,,"Move the selected entries to an existing group. You can select the group to move the entries to, from &lt;no group&gt;, to move the entries into the ungrouped entries, and &lt;new group&gt;, to create a new group.<br/>Opens the Move to Group dialog box.",,
projtable_move_to_new_group,,,,,
projtable_move_to_row,,,"Move the selected entries so that the first entry is at a specified row number, or the first or last row.<br/>Opens the Move to Row dialog box.",,
projtable_moveto_end_of_parent_group,,,,,
projtable_moveto_end_of_table,,,,,
projtable_moveto_existing_group,,,,,
projtable_moveto_top_of_parent_group,,,,,
projtable_moveto_top_of_table,,,,,
projtable_other_row,,,,,
projtable_paste_entryprop,,,"Paste the properties from the clipboard into the selected entries. The existing properties are overwritten. If a property does not exist (or is of a different type) a new property is created for those entries. If a property value is empty in the source entry, the value will be empty in the target entries.",,
projtable_project_toolbar,,,,,
projtable_property_toolbar,,,,,
projtable_property_tree,,,,,
projtable_record_movie,,,"Record an MPEG movie of the selected entries in the Project Table. You can specify the file name or browse to the location, and set options for resolution and speed. Opens the Record Movie dialog box.",,
projtable_reset_entries_color,,,Reset the row coloring of the selected entries to the default color.,,
projtable_select_add,,,Add entries to the selection on the basis of their properties.<br/>Opens the Entry Selection dialog box.,,
projtable_select_all,,,Select all entries in the Project Table.,,
projtable_select_by_property_values,,,Select entries in the Project Table based on a combination of criteria for property values.<br/>Opens the Select Entries by Property Values dialog box.,,
projtable_select_deselect,,,Remove entries from the selection on the basis of their properties.<br/>Opens the Entry Selection dialog box.,,
projtable_select_filter_edit,,,Create or edit a filter for selecting entries using Entry Selection Language (ESL).<br/>Opens the Edit Filter panel.,,
projtable_select_filter_filter1,,,Use the first stored filter to select entries in the Project Table.,,
projtable_select_filter_filter10,,,,,
projtable_select_filter_filter2,,,Use the second stored filter to select entries in the Project Table.,,
projtable_select_filter_filter3,,,Use the third stored filter to select entries in the Project Table.,,
projtable_select_filter_filter4,,,Use the fourth stored filter to select entries in the Project Table.,,
projtable_select_filter_filter5,,,,,
projtable_select_filter_filter6,,,,,
projtable_select_filter_filter7,,,,,
projtable_select_filter_filter8,,,,,
projtable_select_filter_filter9,,,,,
projtable_select_filter_more,,,Use another stored filter to select entries in the Project Table. Opens a dialog box in which you can choose the filter.,,
projtable_select_filter_none_defined,,,,,
projtable_select_firstentry_per_title,,,Select the first entry with a given title in each selected entry group.,,
projtable_select_firstlevel_of_entries,,,Select only the entries at the first level of the selected entry groups.,,
projtable_select_fromgroups,,,,,
projtable_select_invert,,,"Invert the selection: select the unselected entries, and deselect the selected entries.",,
projtable_select_none,,,Deselect all entries in the Project Table.,,
projtable_select_only,,,Select entries on the basis of their properties.<br/>Opens the Entry Selection dialog box.,,
projtable_select_random,,,Randomly select a percentage of the current selected or included entries.<br/>Opens the Random Selection dialog box.,,
projtable_select_smarts,,,Select entries that match one or more SMARTS patterns.<br/>Opens the Select by SMARTS dialog box.,,
projtable_set_entries_color,,,,,
projtable_stars_1,,,Set the number of stars for the selected entries to 1.,,
projtable_stars_2,,,Set the number of stars for the selected entries to 1.,,
projtable_stars_3,,,Set the number of stars for the selected entries to 3.,,
projtable_stars_none,,,Set the number of stars for the selected entries to 0.,,
projtable_unfix_entries,,,"Change any fixed entries in the entry selection so that they are no longer fixed. The entries remain in the Workspace, but can be removed by actions like Include Only. The padlock icon is removed from the In column for these entries.",,
projtable_ungroup,,,Move the selected entries out of their groups to the ungrouped area.,,
projtable_unlock_entries,,,Unlock the selected entries so that they can be modified or deleted. The padlock icon is removed from the Row column for these entries.,,
projtable_view_preferences,,,,,
prosane_gui.panel,,,"Display reports on a variety of protein properties, such as deviations from ideal values, B-factors, and missing atoms.<br/>Opens the Protein Reports panel.",,
protac_gui.panel,degraders,,,Generate Degrader Complexes (Beta)...,Other Applications
protein_descriptors_calc_gui.panel,,,"<!-- ML -->
Calculate descriptors for a protein or antibody that can be used for machine learning.<br/>Opens the Calculate Protein Descriptors Panel.",,
protein_interaction_analysis_gui.panel,"dimer, interaction, interface, multimer, aggregation, hbond",,"Analyze the interactions at the interface of two proteins, defined as two sets of chains. The analysis locates residues in the second set of chains that are within a given distance of residues in the first set of chains, and presents counts of hydrogen bonds, salt bridges, disulfide bonds, pi-pi stacking interactions, and van der Waals clashes, and reports the van der Waals surface complementarity and buried solvent-accessible surface area.<br/>Opens the Protein Interaction Analysis panel.",Protein Interaction Analysis...,Biologics
protein_protein_docking_gui.panel,,,"<!-- protein docking, piper, cluspro -->
Predict the bound conformation for two protein structures. The proteins are held rigid during the docking process. When the process is complete, a rank ordered set of possible poses for the two proteins is returned.<br/>Opens the Protein-Protein Docking panel.",,
protein_reliability_gui.panel,,,"Provide an interactive graphical representation of the reliability of a particular protein structure for modeling, as represented by a variety of physical measures.<br/>Opens the Protein Reliability Report panel.",,
protein_reliability_report,"reliability, protein analysis, protein",,,Protein Reliability Report...,Structure Analysis
protein_reports,"protein analysis, protein, report, quality, protein quality",,,Protein Reports...,Structure Analysis
protein_splicer,"protein splicer, protein splicing, splicer, loop grafting, Prime",,,Protein Splicer...,Protein Preparation and Refinement
protein_splicing,,splicer_gui.panel,,,
protein_structure_quality_gui.panel,,,"<!-- ramachandran -->
Analyze the proteins in the Workspace, and display both tabular and graphical reports on their quality, as measured by deviations from ideal values. An interactive 2-D plot area allows you to select elements of the protein on the basis of their deviations from ideality and have those elements selected in the Workspace for further consideration.<br/>Opens the Protein Structure Quality Viewer panel.",,
protein_titration_gui.panel,,,Generate and display a titration curve for one or more proteins.<br/>Opens the Protein Titration Curve panel.,,
psp,,,"Predict the structure of a protein from its sequence by homology modeling, including multimer and GPCR building, and flexibility in choosing templates, editing alignments, and building the structure.<br/>Opens the Structure Prediction panel.",,
pt_add_interaction_counts,hbond,calcprop,,Add Interaction Counts...,Project Table and Project Operations
pt_add_molecular_properties,,calcprop,,Add Molecular Properties...,Project Table and Project Operations
pt_add_property_by_type,,pt_property_add,,Add Property by Type...,Project Table and Project Operations
pt_add_sequential_index,,calcprop,,Add Sequential Index...,Project Table and Project Operations
pt_add_substructure_count,,,Add properties that are counts of substructures to project entries.<br/>Opens the Add Substructure Count Property Dialog Box.,Add Substructure Count...,Project Table and Project Operations
pt_column_change_property,,,Change display settings or internal settings of entry properties.<br/>Opens the Change Properties Dialog Box.,Change Entry Property....,Project Table and Project Operations
pt_columns_fit_data,,,Set the column width to the width of the longest data value.,,
pt_columns_fit_header,,,Set the column width to the width of the column heading.,,
pt_columns_fit_header_data,,,Set the column width to the maximum of the heading width and the width of the longest data value.,,
pt_compute_relative_energies,,,<br/>Opens the Add Relative Energy Property dialog box,,
pt_customize_menu,,,"Customize the menus in the Project Table panel. You can add, delete, or move items, menus, or submenus, and you can assign shortcut keys and mnemonics. Opens the Customize Menus panel.",,
pt_customize_toolbars,,,"Customize the toolbars in the Project Table panel, by adding, deleting, or moving buttons or toolbars. Opens the Customize Toolbars dialog box.",,
pt_entry_duplicate_copy_properties,,,Select this option if you want to copy the properties of the source entries to the target entries when duplicating entries; deselect it to copy only the structure.,,
pt_entry_split_chain,,,"Split the selected entry into a set of entries, one for each chain in the source entry.",,
pt_entry_split_copy_properties,,,Copy the properties of the source entry to the new entries when the source is split.,,
pt_entry_split_ligand,,,"Split the selected entry into a set of entries, one for each ligand in the source entry, one for the waters, and one for any other atoms, such as a protein.",,
pt_entry_split_molecule,,,"Split the selected entry into a set of entries, one for each molecule in the source entry.",,
pt_export_spreadsheet,,,"Export rows and columns from the Project Table to a CSV file, which can be read into a spreadsheet application. Opens the Export Spreadsheet panel.",,
pt_export_structures,,project_exportstructures,,,
pt_export_to_canvas,,,"Export the selected entries in the Project Table panel with their properties directly to a Canvas project, and open the Canvas GUI with that project loaded. Opens the Export to Canvas dialog box to select options for the Canvas project, then a file selector to name or locate the Canvas project.",,
pt_export_to_pymol,,pymol4maestro.show_panel,,,
pt_export_to_spreadsheet,,pt_export_spreadsheet,,Export to Spreadsheet...,Project Table and Project Operations
pt_find_replace,,,"Show or hide the Find toolbar to find and replace text, in any table cell except the row number.",,
pt_import_spreadsheet,,,"Import data from a spreadsheet into the project as entry properties. Combined with the use of the Export Spreadsheet dialog box, you can export data to a spreadsheet, manipulate it, and re-import it into Maestro. Opens the Import Spreadsheet panel.",,
pt_import_structures,,project_importstructures,,,
pt_import_surfaces,,,Import surfaces or volumes from a file and associate them with the selected entry. There must be only one entry selected for this menu item to be available. Opens a file selector to choose the files.,,
pt_import_vibrational_data,,,Import vibrational data from a Jaguar calculation and associate it with the selected entry. There must be only one entry selected for this menu item to be available. Opens a file selector to choose the file.,,
pt_manage_charts,,,,Manage Charts...,Project Table and Project Operations
pt_mute_row_column_colors,,,,,
pt_preferences,,,"Open the Preferences panel at the Project Table &ndash; Properties tab, so you can set project-related preferences.",,
pt_property_add,,,"Add a new property column to the project table. Opens the Add Property dialog box, in which you can specify the name, type, and precision of the property and its initial value.",,
pt_property_calculate,,calcprop,,,
pt_property_clear,,,Clear the values in the chosen properties for the selected entries or all entries.<br/>Opens the Clear Property Values Dialog Box.,,
pt_property_copy,,,"Copy values from one property to another, for the selected entries or for all entries. <br/>Opens the Copy Property panel.",,
pt_property_custom_families,,,"Create, edit, and delete custom property families.<br/>Opens the Manage Custom Property Families panel.",,
pt_property_decimalplaces,,,Set the number of decimal places displayed for one or more real-valued properties. This item is not on the Property shortcut menu if the property does not have real values.<br/>Opens the Set Decimal Places dialog box.,,
pt_property_delete,,,Delete chosen properties.<br/>Opens the Delete Property dialog box,,
pt_property_hideall,,,"Hide all project properties. Only the Row, In, and Title columns remain visible.",,
pt_property_hideonly_family_maestro,,,,,
pt_property_merge,,,"Merge the values of one or more properties into a destination property, by concatenating the source properties into a string in the selected order, with a specified separator.<br/>Opens the Merge Properties panel.",,
pt_property_primaryonly,,,"Show only the primary properties of each property family, and hide the secondary properties.",,
pt_property_select,,,"Select the properties to show.<br/>Opens the Show Properties dialog box, in which you can choose the properties to show.",,
pt_property_selectedentries,,,"Show only the properties that have values for one or more of the selected entries, and hide all other properties.",,
pt_property_showall,,,Show all project properties.,,
pt_property_showonly_family_maestro,,,Show only the Maestro properties.,,
pt_property_tree,,,"Display a tree view of the properties in the Project Table, which you can use to show and hide properties and property families, locate and scroll to properties.<br/>Opens the Property Tree panel, which is docked to the right of the properties in the table by default.",,
pt_rank_entries,,,Perform Pareto ranking of project entries for 2 to 4 properties. The result is a property that specifies the rank. The entries can be sorted and the top-ranking entries selected after ranking.<br/>Opens the Multivariate Ranking panel.,,
pt_redo_calculation,,,Recalculate values of entry properties that were generated from the structures.<br/>Opens the Recalculate Molecular Properties Dialog Box.,,
pt_reorder_properties,,,Change the order that the properties appear in the Project Table. Opens the Reorder Properties dialog box.,,
pt_select_by_property_values,,projtable_select_by_property_values,,Select by Property Values...,Project Table and Project Operations
pt_select_first_entry_per_title,,projtable_select_firstentry_per_title,,,
pt_select_first_level_entries,,projtable_select_firstlevel_of_entries,,,
pt_show_2d_images,,,"Display 2D structures as a third column in the Project Table. Structures with more than a specified number of atoms (default 200) are not displayed. For protein-ligand complexes, the ligand is displayed, with an icon in the top right to indicate that a protein is present.",,
pt_sort_entries,,,"Sort the entries and entry groups in the Project Table by the values of one or more properties. Entries can be grouped before sorting, and groups can be sorted on the same properties as ungrouped entries or on different properties. Entries with the highest or lowest values can be selected after sorting. The sort can be applied to all entries, or just the selected entries. <br/>Opens the Sort Project Table panel.",,
pt_total_surface_area,,,,Add Total Surface Area...,Project Table and Project Operations
pt_update_substructure_count,,,Update properties that are counts of substructures of project entries.<br/>Opens the Add Substructure Count Property Dialog Box.,,
pt_view_chart,,,,View Chart...,Project Table and Project Operations
pxrd_gui.panel,,,"Locate peaks in a plot of intensity against angle from an x-ray powder diffraction experiment, after removing background. Peaks can be detected automatically and adjusted or assigned manually.<br/>Opens the Powder Diffraction Indexing panel.",,
pymol,,pymol4maestro.show_panel,,,
pymol4maestro.show_panel,,,"View structures from Maestro in PyMOL. You can start and stop PyMOL, send structures from Maestro to PyMOL, and make settings for the PyMOL scene and image.<br/>Opens the PyMOL for Maestro panel.",,
python_shell,,,"Open a window that can be used to run Python commands, with the Schr&ouml;dinger environment set up.<br/>Opens the Python Shell panel.",,
qikprop,"caco, logBB, properties",,"<!-- ADME/T, logP, logS, Caco-2, MDCK, permeability, herg, QSPR, QikProp, quick -->
Calculate ADME properties and 2D and 3D QSAR descriptors of small molecules.<br/>Opens the QikProp panel.",QikProp...,Other Applications
qm_monitor_gui.panel,,,"<!-- qe -->
Monitor the convergence of QM jobs (Jaguar or Quantum Espresso) while they are running.<br/>Opens the QM Monitor panel",QM Convergence Monitor...,Quantum Mechanics
qpld_gui.panel,,,"<!-- qm, Jaguar, QPLD -->
Use quantum mechanically-polarized ligand partial atomic charges and dock ligands to a protein target with Glide.<br/>Opens the QM-Polarized Ligand Docking panel.",,
qsar,,,"Build a 3D QSAR model from a set of aligned ligands, and use the model to predict activities for other molecules. The model can be based on atom types, but not on pharmacophore types.<br/>Opens the Atom-Based QSAR panel.",,
qsar_atom_based,QSAR,,,Atom-Based...,Discovery Informatics and QSAR
qsar_field_based,"QSAR, Comfa, Comsia",,,3D Field-Based...,Lead Optimization
qsite,,,"<!-- impact, jaguar -->
Perform mixed quantum mechanical/molecular mechanical (QM/MM) calculations on proteins and protein-ligand complexes.<br/>Opens the QSite panel.",QSite...,Other Applications
query_bonds_gui.panel,,,"Find bonds in a structure by element pair, order, or length, and delete or change the order of selected bonds.<br/>Opens the Query Bonds Panel.",,
query_csd_gui.panel,,,"Send a query to Mogul for a set of ligand molecules, to obtain a report on the match between the geometric parameters of the molecules and those found in the Cambridge Structural Database (CSD).<br/>Opens the Query Cambridge Structural Database panel.",,
query_materials_local_gui.panel,,,"Search the local file system for structures that match an ASL expression or contain specified structure properties, and import the results into the project.<br/>Opens the Query Local Materials panel",,
query_materials_mp_gui.panel,,,Query the databases of the Materials Project.<br/>Opens the Query Materials Project Database panel,,
quick_shape_screening,"virtual screen, Quick Shape Screening, screen, screening",,,Quick Shape Screening...,Ligand-Based Virtual Screening
r_group_analysis.show_panel,,,"Identify the groups that are attached to a common core in a series of molecules and display properties of the identified R groups. The core can be taken from CombiGlide attachment bond labeling, specified by a SMARTS pattern, or determined by the maximum common substructure obtained from a Canvas MCS run.<br/>Opens the R-Group Analysis panel.<!-- SAR, structure-activity relationship -->",,
r_group_library_gui.ligand_panel,,,Create and edit ligands for metal complexes and manage ligand libraries.<br/>Opens the Ligand Creator panel,,
r_group_library_gui.panel,"fragment, enumeration, library, interactive enumeration, r group, rgroup, r-group",,"Create and edit R groups, and manage R-group libraries.<br/>Opens the R-Group Creator panel.",Create R-Group Library...,Enumeration and Ideation
rama_gui.panel,,,"<!-- torsion -->
Display a Ramachandran plot of protein phi and psi dihedral angles.<br/>Opens the Ramachandran Plot panel.",,
ramachandran_plot,protein analysis,,,Ramachandran Plot...,Structure Analysis
rapid_torsion_scan,"torsion, small molecule analysis, rotamers, torsion scan",,,Rapid Torsion Scan...,Workspace Operations
rapid_torsion_scan_gui.panel,,,"Scan the orientations around a ligand bond or view rotamer states of a selected protein residue, and see a breakdown of the energy for each orientation or state. No relaxation of the structure is done during the scan.<br/>Opens the Rapid Torsion Scan panel.",,
raytrace.run,,,"Create a ray trace image of the Workspace, using PyMOL.<br/>Opens a file browser to specify the output file.",,
rdf_gui.panel,,,"<!-- desmond, analysis -->
Calculate and plot radial distribution functions from a molecular dynamics simulation.<br/>Opens the Radial Distribution Function panel.",,
reaction_based_enum_gui.panel,"reaction-based, enumeration, PathFinder",,Enumerate structures by substitution of R groups in the reactants and products of a single- or multi-step reaction.<br/>Opens the Reaction-Based Enumeration panel,Reaction-Based Enumeration...,Enumeration and Ideation
reaction_energetics_enumeration,"QM, quantum mechanics",,,Reaction Energetics Enumeration...,Quantum Mechanics
